pub_date	title	venue	excerpt	citation	url_slug	paper_url
2016-07-24	Enhancing character posing by a sketch-based interaction	SIGGRAPH '16	Sketch as the most intuitive and powerful 2D design method has been used by artists for decades. However it is not fully integrated into current 3D animation pipeline as the difficulties of interpreting 2D line drawing into 3D. Several successful research for character posing from sketch has been presented in the past few years, such as the Line of Action [Guay et al. 2013] and Sketch Abstractions [Hahn et al. 2015]. However both of the methods require animators to manually give some initial setup to solve the corresponding problems. In this paper, we propose a new sketch based character posing system which is more flexible and efficient. It requires less input from the user than the system from [Hahn et al. 2015]. The character can be easily posed no matter the sketch represents a skeleton structure or shape contours.	Barbieri, Simone, et al. "Enhancing character posing by a sketch-based interaction." <i>ACM SIGGRAPH 2016 Posters. ACM, 2016.</i>	enhancing	https://www.researchgate.net/profile/Simone_Barbieri3/publication/305081809_Enhancing_character_posing_by_a_sketch-based_interaction/links/59fae99fa6fdcc9a1627053b/Enhancing-character-posing-by-a-sketch-based-interaction.pdf
2019-06-19	Technological Infrastructure supports new paradigm of care for healthy aging: The Living Lab Ausilia	ForItAAL2019	Living labs are spaces where public and private stakeholders work together to develop and prototype new products, technologies and services in real environments embedded in the community or market place. This paper outlines the approach chosen by AUSILIA (Assisted Unit for Simulating Independent Living Activities), a living lab established in Provincia Autonoma di Trento in 2016 to develop an innovation model for taking care of the elderly or disabled patient by fusion of technology innovation and patient centered integrated care approach. AUSILIA goal is triple: i. to provide an innovative framework based on augmented virtual reality for occupational therapy in ageing and fragile individuals; ii. to help people who are losing autonomy and independence living at home reducing care burden; iii. warrant continuous innovation through the mixed contribution of the academy and private enterprise. The paper describes the specific solutions adopted for the three objectives, reporting an implementation example for each of them.	Grisenti, Andrea, et al. "Technological Infrastructure supports new paradigm of care for healthy aging: The Living Lab Ausilia." <i>10 Forum Italiano Ambient Assisted Living, 19-21 Giugno 2019, Ancona, Italia</i>	ausilia	http://mmlabsites.disi.unitn.it/ausilia/index.php/pubblicazioni/
2019-09-02	Virtual Crowds: An LSTM-Based Framework for Crowd Simulation.	ICIAP 2019	Social modeling of pedestrian dynamics is a key element to understand the behavior of crowded scenes. Existing crowd models like the Social Force Model and the Reciprocal Velocity Obstacle, traditionally rely on empirically-defined functions to characterize the dynamics of a crowd. On the other hand, frameworks based on deep learning, like the Social LSTM and the Social GAN, have proven their ability to predict pedestrians trajectories without requiring a predefined mathematical model. In this paper we propose a new paradigm for crowd simulation based on a pool of LSTM networks. Each pedestrian is able to move independently and interact with the surrounding environment, given a starting point and a destination goal.	Bisagno, Niccoló, et al. "Virtual Crowds: An LSTM-Based Framework for Crowd Simulation." <i>International Conference on Image Analysis and Processing. Springer, Cham, 2019.</i>	virtualcrowds	https://www.researchgate.net/publication/335604661_Virtual_Crowds_An_LSTM-Based_Framework_for_Crowd_Simulation
2010-10-01	Paper Title Number 2	Journal 1	This paper is about the number 2. The number 3 is left for future work.	Your Name, You. (2010). "Paper Title Number 2." <i>Journal 1</i>. 1(2).	paper-title-number-2	http://academicpages.github.io/files/paper2.pdf
2015-10-01	Paper Title Number 3	Journal 1	This paper is about the number 3. The number 4 is left for future work.	Your Name, You. (2015). "Paper Title Number 3." <i>Journal 1</i>. 1(3).	paper-title-number-3	http://academicpages.github.io/files/paper3.pdf